{
  "format_version": "canton-solvency-anchor-v1",
  "report_digest": "0800c1047c9724ea429b238b01366f2032d674425d3ed745ed3402b2f534df61",
  "root_hash": "02885b0fc65c3d8992899c8acba1917cb838b18b7054b6675e3d89f2bf8f0970",
  "snapshot_time": "2026-01-01T00:00:00Z",
  "ledger_offset": "000000000000000042",
  "publisher": "golden::publisher"
}
