[
  {
    "format_version": "canton-solvency-anchor-v1",
    "ledger_offset": "000000000000000043",
    "prev_anchor": "c82ee8ab02afaff1f01fe4266a190e3ca1e45f1a89b007678643a63fd4003764",
    "publisher": "golden::publisher",
    "report_digest": "0800c1047c9724ea429b238b01366f2032d674425d3ed745ed3402b2f534df61",
    "root_hash": "02885b0fc65c3d8992899c8acba1917cb838b18b7054b6675e3d89f2bf8f0970",
    "snapshot_time": "2026-01-02T00:00:00Z"
  }
]
